{"schema_version":1,"kind":"meridian-structural-delta","from":{"repo":"https://example.test/acme/widgets.git","ref":"aaaaaaaaaaaaaaaaaaaaaaaaaaaaaaaaaaaaaaaa"},"to":{"repo":"https://example.test/acme/widgets.git","ref":"bbbbbbbbbbbbbbbbbbbbbbbbbbbbbbbbbbbbbbbb"},"origin":{"actor":"meridian:diff"},"ops":[{"t":"edge:remove","graph":"g-root","id":"e-dep","prev":{"id":"e-dep","src":"n-project","dst":"n-old","kind":"code:imports","attrs":{},"provenance":{"origin":"derived","uri":"old.py"}}},{"t":"node:detail","graph":"g-root","id":"n-project","prev":{"graph":"g-package-a"}},{"t":"node:remove","graph":"g-root","id":"n-old","prev":{"id":"n-old","kind":"code:module","label":"old.py","attrs":{},"provenance":{"origin":"source","uri":"old.py"}}},{"t":"node:add","graph":"g-root","node":{"id":"n-new","kind":"code:module","label":"new.py","attrs":{},"provenance":{"origin":"source","uri":"new.py"}}},{"t":"node:add","graph":"g-package-a","node":{"id":"n-added","kind":"code:function","label":"added","attrs":{},"provenance":{"origin":"source","uri":"src/added.py"}}},{"t":"node:detail","graph":"g-root","id":"n-destination","next":{"graph":"g-package-a"}},{"t":"edge:add","graph":"g-root","edge":{"id":"e-new","src":"n-project","dst":"n-new","kind":"code:imports","attrs":{},"provenance":{"origin":"derived","uri":"new.py"}}}]}
